{"schemaVersion":"1.0.0","generatedAt":"2026-04-23T11:20:56.949Z","manifestFile":"mf-manifest.json","statsFile":"mf-stats.json","metaData":{"pluginName":"vite-plugin-federation","pluginVersion":"0.0.3"},"options":{"bundleAllCSS":false,"compatibility":{"originjs":true,"virtualFederationShim":true},"filename":"remoteEntry.js","publicPath":"/","shareStrategy":"version-first"},"capabilities":{"debugArtifacts":true,"manifest":true,"remoteHmr":false,"ssr":true,"stats":true,"types":false},"remotes":[],"shared":[{"import":"/Users/unadlib/Sites/vite-plugin-federation/examples/shared-negotiation-remote/src/shared-value.js","requiredVersion":"*","singleton":true,"strictSingleton":false,"strictVersion":false,"version":"2.0.0","name":"@mf-e2e/shared-value"}],"exposes":[{"import":"./src/Widget.js","name":"./Widget"}],"diagnostics":{"controlChunks":[{"fileName":"assets/hostInit-CfGMGlAC.js","isEntry":true,"type":"chunk"},{"fileName":"assets/virtualExposes-n14WCUkF.js","isEntry":true,"type":"chunk"},{"fileName":"remoteEntry.js","isEntry":true,"type":"chunk"},{"fileName":"remoteEntry.ssr.js","isEntry":true,"type":"chunk"},{"fileName":"assets/__mfe_internal__sharedRemote__loadShare___mf_0_mf_mf_2_e2e_mf_1_shared_mf_2_value__loadShare__.mjs-YQTvRQel.js","isEntry":false,"type":"chunk"},{"fileName":"assets/localSharedImportMap-C8bXVDJl.js","isEntry":false,"type":"chunk"},{"fileName":"assets/virtual_mf-REMOTE_ENTRY_ID___mfe_internal__sharedRemote__remoteEntry_js-B3HRMM9z.js","isEntry":false,"type":"chunk"},{"fileName":"assets/virtual_mf-SSR_REMOTE_ENTRY_ID___mfe_internal__sharedRemote__remoteEntry_js-CDF5Oio3.js","isEntry":false,"type":"chunk"},{"fileName":"assets/virtual_mf-exposes___mfe_internal__sharedRemote__remoteEntry_js-8_mex4w2.js","isEntry":false,"type":"chunk"}],"remoteAliases":[],"sharedResolution":[{"concreteImportSource":"/Users/unadlib/Sites/vite-plugin-federation/examples/shared-negotiation-remote/src/shared-value.js","configuredImport":"/Users/unadlib/Sites/vite-plugin-federation/examples/shared-negotiation-remote/src/shared-value.js","fallbackMode":"concrete-import","importDisabled":false,"key":"@mf-e2e/shared-value","matchType":"exact","allowNodeModulesSuffixMatch":false,"requiredVersion":"*","resolutionRoot":null,"resolutionSource":"configured-import","resolvedPackageEntry":"/Users/unadlib/Sites/vite-plugin-federation/examples/shared-negotiation-remote/src/shared-value.js","singleton":true,"strictSingleton":false,"strictVersion":false,"used":true,"version":"2.0.0"}],"ssr":{"hasGetPublicPath":false,"hasSsrRemoteEntry":true,"publicPath":"/","remoteEntryFile":"remoteEntry.js","ssrRemoteEntryFile":"remoteEntry.ssr.js"}},"snapshot":{"schemaVersion":"1.0.0","id":"sharedRemote","name":"sharedRemote","release":{"id":"sharedRemote:local","buildName":"sharedRemote","buildVersion":"local"},"metaData":{"name":"sharedRemote","type":"app","buildInfo":{"buildVersion":"local","buildName":"sharedRemote","releaseId":"sharedRemote:local"},"remoteEntry":{"name":"remoteEntry.js","path":"","type":"module","contentHash":"da14bb42d4bcab722c50a1da63b2bcd0e0433f35ff9d7f332a7badda7d56c8c7","integrity":"sha384-oKGVvLBzRapruXRZmtUfk/2PZEW4jgP/XTiVyiMvCLPBaG7Pejp/MfxftsbT2GbY"},"ssrRemoteEntry":{"name":"remoteEntry.ssr.js","path":"","type":"module","contentHash":"261b7718fa6ac1f90f8510a57e33f1548a3c778415ed9cc9152fb562a3b22d5a","integrity":"sha384-Agxzgj6mOLW/seixn3dOY95Hrbf2ExJHE1zeqAVwir5+SsBmBi0FaDZJFT9UxzuP"},"types":{"path":"","name":"","api":""},"globalName":"sharedRemote","pluginVersion":"0.0.3","publicPath":"/"},"shared":[{"id":"sharedRemote:@mf-e2e/shared-value","name":"@mf-e2e/shared-value","version":"2.0.0","singleton":true,"requiredVersion":"*","allowNodeModulesSuffixMatch":false,"strictSingleton":false,"assets":{"js":{"async":[],"sync":["assets/shared-value-CJrTKsBK.js"]},"css":{"async":[],"sync":[]}}}],"remotes":[],"exposes":[{"id":"sharedRemote:Widget","name":"Widget","css":{"mode":"head"},"assets":{"js":{"async":[],"sync":["assets/Widget-Cc0PZJi9.js"]},"css":{"async":[],"sync":[]}},"path":"./Widget"}]}}