{"schemaVersion":"1.0.0","generatedAt":"2026-04-23T13:33:03.256Z","manifestFile":"mf-manifest.json","statsFile":"mf-stats.json","metaData":{"pluginName":"vite-plugin-federation","pluginVersion":"0.0.3"},"options":{"bundleAllCSS":false,"compatibility":{"originjs":true,"virtualFederationShim":true},"filename":"remoteEntry-[hash]","publicPath":"/","shareStrategy":"loaded-first"},"capabilities":{"debugArtifacts":true,"manifest":true,"remoteHmr":false,"ssr":true,"stats":true,"types":false},"remotes":[],"shared":[{"import":"/Users/unadlib/Sites/vite-plugin-federation/examples/shared-negotiation-host/src/shared-value.js","requiredVersion":"*","singleton":true,"strictSingleton":false,"strictVersion":false,"version":"1.0.0","name":"@mf-e2e/shared-value"}],"exposes":[],"diagnostics":{"controlChunks":[{"fileName":"assets/hostInit-DKI78o6y.js","isEntry":true,"type":"chunk"},{"fileName":"assets/remoteEntry-D406gCEz.js","isEntry":true,"type":"chunk"},{"fileName":"assets/virtualExposes-BmMSo6BF.js","isEntry":true,"type":"chunk"},{"fileName":"assets/localSharedImportMap-CBubDxDb.js","isEntry":false,"type":"chunk"},{"fileName":"assets/virtual_mf-REMOTE_ENTRY_ID___mfe_internal__sharedHost__remoteEntry-_hash_-DBqRwxc3.js","isEntry":false,"type":"chunk"},{"fileName":"assets/virtual_mf-exposes___mfe_internal__sharedHost__remoteEntry-_hash_-DNIic1Te.js","isEntry":false,"type":"chunk"}],"remoteAliases":[],"sharedResolution":[{"concreteImportSource":"/Users/unadlib/Sites/vite-plugin-federation/examples/shared-negotiation-host/src/shared-value.js","configuredImport":"/Users/unadlib/Sites/vite-plugin-federation/examples/shared-negotiation-host/src/shared-value.js","fallbackMode":"concrete-import","importDisabled":false,"key":"@mf-e2e/shared-value","matchType":"exact","allowNodeModulesSuffixMatch":false,"requiredVersion":"*","resolutionRoot":null,"resolutionSource":"configured-import","resolvedPackageEntry":"/Users/unadlib/Sites/vite-plugin-federation/examples/shared-negotiation-host/src/shared-value.js","singleton":true,"strictSingleton":false,"strictVersion":false,"used":true,"version":"1.0.0"}],"ssr":{"hasGetPublicPath":false,"hasSsrRemoteEntry":true,"publicPath":"/","remoteEntryFile":"assets/remoteEntry-D406gCEz.js","ssrRemoteEntryFile":"remoteEntry-[hash]"}},"snapshot":{"schemaVersion":"1.0.0","id":"sharedHost","name":"sharedHost","release":{"id":"sharedHost:local","buildName":"sharedHost","buildVersion":"local"},"metaData":{"name":"sharedHost","type":"app","buildInfo":{"buildVersion":"local","buildName":"sharedHost","releaseId":"sharedHost:local"},"remoteEntry":{"name":"assets/remoteEntry-D406gCEz.js","path":"","type":"module","contentHash":"67ea1e6bd1ff0669cf5642b7a5fc6bf8881340ccd18d192740d54e39587129c1","integrity":"sha384-MDlMQwkrExfecu/DDpYVYKLwarDRRS+ZUG1P9UeyY+jgk/dZKIUBiKa4vHT4wQvQ"},"ssrRemoteEntry":{"name":"remoteEntry-[hash]","path":"","type":"module"},"types":{"path":"","name":"","api":""},"globalName":"sharedHost","pluginVersion":"0.0.3","publicPath":"/"},"shared":[{"id":"sharedHost:@mf-e2e/shared-value","name":"@mf-e2e/shared-value","version":"1.0.0","singleton":true,"requiredVersion":"*","allowNodeModulesSuffixMatch":false,"strictSingleton":false,"assets":{"js":{"async":[],"sync":["assets/shared-value-CBLDJVfk.js"]},"css":{"async":[],"sync":[]}}}],"remotes":[],"exposes":[]}}