{
  "schemaVersion": "1.0.0",
  "generatedAt": "2026-04-22T00:00:00.000Z",
  "manifestFile": "mf-manifest.json",
  "statsFile": "mf-stats.json",
  "metaData": {
    "pluginName": "vite-plugin-federation",
    "pluginVersion": "0.0.3"
  },
  "options": {
    "filename": "remoteEntry.js",
    "manifest": true,
    "shareStrategy": "loaded-first"
  },
  "capabilities": {
    "debugArtifacts": true,
    "manifest": true,
    "ssr": true,
    "stats": true,
    "types": true
  },
  "remotes": [],
  "shared": [
    {
      "name": "react",
      "singleton": true,
      "requiredVersion": "^19.2.4",
      "version": "19.2.4"
    }
  ],
  "exposes": [
    {
      "name": "./Button",
      "import": "./src/Button.tsx"
    }
  ],
  "diagnostics": {
    "controlChunks": [],
    "remoteAliases": []
  },
  "snapshot": {
    "schemaVersion": "1.0.0",
    "id": "catalogRemote",
    "name": "catalogRemote",
    "metaData": {
      "name": "catalogRemote",
      "type": "app",
      "buildInfo": {
        "buildName": "main",
        "buildVersion": "abc1234"
      },
      "remoteEntry": {
        "name": "remoteEntry.js",
        "path": "",
        "type": "module"
      },
      "ssrRemoteEntry": {
        "name": "remoteEntry.ssr.js",
        "path": "server",
        "type": "module"
      },
      "types": {
        "path": "",
        "name": "@mf-types.zip",
        "api": "@mf-types.d.ts"
      },
      "globalName": "catalogRemote",
      "pluginVersion": "0.0.3",
      "publicPath": "https://cdn.example.com/catalog/"
    },
    "shared": [
      {
        "id": "catalogRemote:react",
        "name": "react",
        "version": "19.2.4",
        "singleton": true,
        "requiredVersion": "^19.2.4",
        "assets": {
          "js": {
            "async": [],
            "sync": ["assets/react.js"]
          },
          "css": {
            "async": [],
            "sync": []
          }
        }
      }
    ],
    "remotes": [],
    "exposes": [
      {
        "id": "catalogRemote:Button",
        "name": "Button",
        "css": {
          "mode": "head"
        },
        "assets": {
          "js": {
            "async": [],
            "sync": ["assets/Button.js"]
          },
          "css": {
            "async": [],
            "sync": ["assets/Button.css"]
          }
        },
        "path": "./Button"
      }
    ]
  }
}
